Name,Comment,Date
EDZ,"elchiki said:I have just ordered my Grecale Trofeo today !😃😃 🚘Grey lava outside and red inside. Delivery should be end of June. 8.2 % discount.Click to expand...Congrats on your order There was a discussion with regards to discount and delivery in an earlier thread in this post. It appears to only be Switzerland that seems to get discount, but as the post said to be on par with other European buyers on price you would need to achieve a discount around 20% to be in line, as Swiss prices are way way above the rest of Europe. Good luck and hope such a short delivery time pans out for you.","April 19, 2023"
elchiki,"GrecaleQVTrofeo said:Well, elchiki wroteend of June, but he did not mention the year.Click to expand...For Switzerland, it is 1^st class service 😂😂","April 19, 2023"
1stMaserati,"Trident said:Figners crossed you can finally get a resolution and you can go back to enjoying your Grecale!Click to expand...Well therein lies the problem…. EDZ is not back to enjoying, he has been waiting since forever to get the Primaserie delivered!!!!!","April 2, 2023"
UKTrofeo,One other point to note is that the screws that Maserati supplies to fix the rear number plate to the rear plate holder are too long and therefore go into the paintwork causing damage. This was spotted by my ppf installer and fully rectified by my dealer free of charge. The dealer checked their other Grecales and ALL of them had damaged paintwork as a result of the long screws. Once rectified and the ppf installed I binned the rear number plate holder and just installed the rear number plate with thick double sided sticky foam pads. (The sticky pads would adhere to the rear number plate holder securely!!),"April 3, 2023"
UKTrofeo,Tony Mac said:May I ask the approximate cost for Full Body PPF?Click to expand...Not cheap. About £5k including full paintwork detail,"April 3, 2023"
UKTrofeo,"I’d suggest not doing the coating on the front where the ppf is going. I had full body ppf install done and my independent xpel installer strongly recommended avoiding the Gtechniq completely as the ppf fits better without it. Xpel actually designed the ppf for the Trofeo with my actual car, as it was the first Trofeo with a full body install","April 3, 2023"
EDZ,"edit said:To be honest, if I was you, I will take the car as it is and return for repairs only when the spare parts needed have arrived.Because it is possible for them to have problems in the suply chain, as the model is new and also a niche model. Maybe you will wait another 1 or 2 moths for the spare parts.Back in 2008 I had a brand new model of Audi A4 and hit a dog with it. As the model of the car was new, I had to wait over 1 month for the spare parts to come, as it was difficult for them to supply. And it wasnt a niche model and it wasnt the times we are living today.My 2 cents.Click to expand...Thanks for your 2 cents edit, appreciated. I have been in discussions with the dealer with regard to different scenarios/outcomes with regards to repairs and further possible delays.The car has also got to be fully ceramic coated (Gtechniq) and protected inside and out along with frontal PPF, which needs doing before collecting really.","April 3, 2023"
Tony Mac,"UKTrofeo said:I’d suggest not doing the coating on the front where the ppf is going. I had full body ppf install done and my independent xpel installer strongly recommended avoiding the Gtechniq completely as the ppf fits better without it. Xpel actually designed the ppf for the Trofeo with my actual car, as it was the first Trofeo with a full body installClick to expand...May I ask the approximate cost for Full Body PPF?","April 3, 2023"
UKTrofeo,But apart from the number plate issue and the tracker fob triggering alerts even when the fob is in the car (this has stopped happening now so maybe a software update was done) the car has been wonderful (now done about 1500 miles),"April 3, 2023"
EDZ,"EDZ said:Thanks for your 2 cents edit, appreciated. I have been in discussions with the dealer with regard to different scenarios/outcomes with regards to repairs and further possible delays.The car has also got to be fully ceramic coated (Gtechniq) and protected inside and out along with frontal PPF, which needs doing before collecting really.Click to expand...UKTrofeo said:I’d suggest not doing the coating on the front where the ppf is going. I had full body ppf install done and my independent xpel installer strongly recommended avoiding the Gtechniq completely as the ppf fits better without it. Xpel actually designed the ppf for the Trofeo with my actual car, as it was the first Trofeo with a full body installClick to expand...Thanks for the pointer UKTrefeo 👍 Will have a word with the detailer before undertaking.Pleased to read things have and are good with your Trefeo.","April 3, 2023"
Tony Mac,"UKTrofeo said:Not cheap. About £5k including full paintwork detailClick to expand...ThanksWe had the same issue with the Tracker Fob for the first week after taking delivery. Leaving the Security Fob in a coat pocket placed on the rear seat or in wife’s handbag, triggered alerts and phone calls.Vodafone got quite annoyed and said take it out of the leather Maserati pouch - we ignored this. But started placing the Key + Fob in the central cup-holder, which stopped the alerts.Dealer said it shouldn’t be an issue leaving the Fob in the pouch, so long as it was in the car.Will experiment placing it in ‘other’ places to see if this has been fixed.","April 3, 2023"
edit,"To be honest, if I was you, I will take the car as it is and return for repairs only when the spare parts needed have arrived.Because it is possible for them to have problems in the suply chain, as the model is new and also a niche model. Maybe you will wait another 1 or 2 moths for the spare parts.Back in 2008 I had a brand new model of Audi A4 and hit a dog with it. As the model of the car was new, I had to wait over 1 month for the spare parts to come, as it was difficult for them to supply. And it wasnt a niche model and it wasnt the times we are living today.My 2 cents.","April 3, 2023"
EDZ,"1stMaserati said:Well therein lies the problem…. EDZ is not back to enjoying, he has been waiting since forever to get the Primaserie delivered!!!!!Click to expand...Very true 1st Maserati But at least it's now finally in the UK at the dealers, taken over thirteen months  which should had been only four to five months  I've seen it so it's true finally here be it damaged  so hopefully will, if nothing else goes wrong, be driving it at the weekend 🤞 Been a long stressful, frustrating and very drawn out process.","April 3, 2023"
edit,"So, my downpayment was on 22nd of february and the dealer called me today to say the production time is week 16, so starting with 17th of April. I will have my Modena on week 19 so no later than 12th of MayGood news","April 4, 2023"
Dai Uy Ted,"Dai Uy Ted said:I ordered a GT today, from Harper Maserati in Knoxville TN. Blue/gray; 20"" wheels w/blue calipers; open pore radica wood trim & ambient lighting; premium pkg; ass't pkg 1; tech pkg (HUD & wireless charger).Dealer could not guess at delivery date. I'll make due in the meanwhile with my Stelvio & Mustang...Click to expand...I recently asked the dealer when my order might be acknowledged by Maserati. They couldn't guess, because at this point the car would be a MY 2024. Since we don't know the pricing, or what colors/options might be offered then, I started looking at alternatives. Decided on a used Levante, letting first owner absorb the depreciation. I bought a 2010 Nero Levante S GranSport at a terrific price.Gotta switch forums...","April 4, 2023"
Tony Mac,"edit said:So, my downpayment was on 22nd of february and the dealer called me today to say the production time is week 16, so starting with 17th of April. I will have my Modena on week 19 so no later than 12th of MayGood newsClick to expand...Did they give you a Year 😂😂","April 4, 2023"
EDZ,"Dai Uy Ted said:I recently asked the dealer when my order might be acknowledged by Maserati. They couldn't guess, because at this point the car would be a MY 2024. Since we don't know the pricing, or what colors/options might be offered then, I started looking at alternatives. Decided on a used Levante, letting first owner absorb the depreciation. I bought a 2010 Nero Levante S GranSport at a terrific price.Gotta switch forums...Click to expand...Congrats on the purchase of the Levante, hope it proves to be a good car for you, the one I'm currently driving on loan is good and have enjoyed the last 5 months with it.You don't have to change forums, owning or buying a Grecale is not a criteria of membership  and hopefully as the forum grows it will have varying topics of interest and you never know could help in any future car purchase.All the best","April 4, 2023"
edit,"Tony Mac said:Did they give you a Year 😂😂Click to expand...No, 2 months and something. It is about february this year","April 4, 2023"
1stMaserati,"Send pics!!!!!!!!!Hope you enjoy the ride home!!! As you also came from a Macan, I think the Grecale just exudes style and grace inside and out. Plus the trofeo should have more kick than a GTS.","April 5, 2023"
EDZ,"Just had phone call. !! Car all repaired and out being ceramic coated PPF etc. Finally collecting the car this Saturday 😊 Do hope the very long wait, all the delays and frustrations will be worth it and it lives up to my expectations. 🤞","April 5, 2023"
Tony Mac,Only 3 more Sleeps before you get the keys 👍Looking forward to hearing your thoughts comparing the Trofeo & Macan,"April 5, 2023"
TF007,@EDZ nice. Looking forward to your first report with pictures,"April 6, 2023"
1stMaserati,@EDZ did it arrive?,"April 9, 2023"
Harry Flashman,"That is almost wilfully ugly. Dumpy, uncohesive and a real mess. Just look at the overhangs!","December 16, 2022"
EDZ,"Just had a phone call from my dealer, can't believe what Iv'e just been told, yet another delay and not to expect my car before February 2023 but more than likely beginning of March 2023 😒 but still no actual confirmed date for arrival. To say I had a few choice words to air with them is an understatement, but hats off to the manufacturer and dealer with a better customer relationship response this time and for now what they have done and given has soften the blow a little, but they still have a little work to do to reinstate my confidence and trust in them, lets wait and see what happens next.","December 16, 2022"
UKTrofeo,"Oh no! That’s no good. I’ve just phoned my UK dealer and on their system my car is still showing as week 52, but I guess there is a good chance mine is going to be further delayed as well. Did they give any reason for the delay?","December 16, 2022"
EDZ,"UKTrofeo said:Oh no! That’s no good. I’ve just phoned my UK dealer and on their system my car is still showing as week 52, but I guess there is a good chance mine is going to be further delayed as well. Did they give any reason for the delay?Click to expand...To be honest I think I have had every excuse in the book since ordering. This time Iv'e been told it's to do with the specialist colour finish which is done out of house, and it's them that are having problems. So you may still be lucky and get yours, will be interesting if you don't then I will know if what Iv'e been told is true or not. Good luck","December 16, 2022"
Maxus,"Whilst they may have similar DNA, this looks to sit much better than the Tonale, which looks a bit gangly to me.I quite like the look of it and hope it leads to seeing more Maseratis on the roads.","December 16, 2022"
Boom78,I’m sorry but that looks hanging I don’t mind an SUV but the proportions and styling look way out,"December 16, 2022"
Turbobanana,"Well, I think we've ticked all the boxes:Italian electricsOverhangsPowerHow much?!?! Non-Germanic colourIt's not a MacanDepreciationPH: predictability matters. Oh, wait, 'Ring time. Damn","December 16, 2022"
pSyCoSiS,"Side and rear look good, but that front end is a bit weird.  Interior not bad.It looks relatively small in the initial shots, but then when you see the one with the drive inside, it seems quite a large car.","December 16, 2022"
wpa1975,"stuckmojo said: It's a Stelvio, isn't it?Yep same platform (FCA Giorgio)","December 16, 2022"
ducnick,"I saw one in a silver at the local maserati dealers recently. It doesn’t look too bad in the metal in a normal colour, but I can’t imagine why anyone would buy oner over a macan, x3, q5, etc to be honest.It’s a competitive sector and the Maserati badged fiat/jeep/Alfa blob has no redeeming qualities other than its badge.","December 16, 2022"
Whydoyoutalkcrap,Sorry but I'd love to know what they were smoking when they came up with those prices!,"December 16, 2022"
epom,"Looks a bit gruesome to me, but hey, impossible please everyone.","December 16, 2022"
nismo48,GTRene said: It looks very BIG looking at this picture compared to the person driving it.+1 he does look rather lost,"December 16, 2022"
MayNine,"While it's not very exciting or novel, I don't hate it. I can't recall the last time I saw a Maserati on UK roads, but this looks like it might sell a few - for better or worse.","December 16, 2022"
cerb4.5lee,"I like the look of this, and I've always wanted to own a Maserati too. I think that this should sell pretty well I reckon.","December 16, 2022"
Baldchap,"There were about 20 Lavantes in my small village, but they seemed to disappear within about three months.  I have no idea why. Be interested to see if this is the same.I do know a thing or two about this car but don't want to get anyone in bother.  All I'll say is I won't be buying one.","December 16, 2022"
NGK210,"Preferable to the usual suspects but similar to its Tonale cousin, it has ‘orrible front and rear overhangs. Is Stellantis trying to set a trend or prioritising platform-sharing economies of scale above aesthetics?","December 16, 2022"
limpsfield,"MayNine said: While it's not very exciting or novel, I don't hate it. I can't recall the last time I saw a Maserati on UK roads, but this looks like it might sell a few - for better or worse. As an ex Maserati owner a long time ago I would agree with this.  That front end still looks a bit ""Ford-looking"" to me.An interesting alternative to a Macan.","December 16, 2022"
cerb4.5lee,"Baldchap said: There were about 20 Lavantes in my small village, but they seemed to disappear within about three months.  I have no idea why. I was interested in the diesel Lavante until I looked at its performance/economy mix. It was a fair bit behind the Merc GLC350d that I had at the time in comparison in that regard, so I dismissed it in the end.","December 16, 2022"
Ryan_T,"The headlights make it look like the Ford Puma crossover, ha.","December 16, 2022"
greggy50,Interested to see what the electric version comes in at.If its sub £80k I think they could be onto a winner.,"December 16, 2022"
emperorburger,Hats off to anyone that wants to put 14 grand down and pay £566 a month for this on a PCP.,"December 16, 2022"
Roger Irrelevant,"emperorburger said: Hats off to anyone that wants to put 14 grand down and pay £566 a month for this on a PCP. It did strike me as a bit odd when the article said (basically) - 'It's £58.5k, which is a lot, but it's ok because it's actually £14k and £566 a month'. So a bit over £34k to drive a not-particularly-attractive 4-pot SUV with a list price of £58k for 3 years...that still seems quite a lot. And it's 'only' about as quick as the X3 30d I've been considering, which isn't a performance SUV as such. I suppose if the Maserati badge means a lot to you then it may make sense, but it doesn't to me.Edit: in fairness on re-reading it the article isn't implying that the cost via PCP is ok, if anything it studiously avoids saying anything one way or the other!  Edited by Roger Irrelevant on Friday 16th December 15:37","December 16, 2022"
Water Fairy,"cerb4.5lee said:Baldchap said: There were about 20 Lavantes in my small village, but they seemed to disappear within about three months.  I have no idea why. I was interested in the diesel Lavante until I looked at its performance/economy mix. It was a fair bit behind the Merc GLC350d that I had at the time in comparison in that regard, so I dismissed it in the end. I think our LCI F25 X3 35d is actually quite competitive still regarding those two measures. Ours is fully specced as well, and I mean fully specced. 22k from a dealer earlier in the year with warranty.I can see something like this on our driveway in a few years.","December 16, 2022"
bennytheball,"[quote=Ryan_T]The headlights make it look like the Ford Puma crossover, ha. True, but the Puma is so much better resolved everywhere else...The Macan shows a compact SUV can be good looking. This thing just looks dumpy to me.","December 16, 2022"
wpa1975,The colour does not help but it looks very bloated styling wise,"December 16, 2022"
TheMilkyBarKid,Kind of looks like a bit like an Alfa Giulietta that let itself go and put on a bit of timber to me?Edited by TheMilkyBarKid on Friday 16th December 23:35,"December 16, 2022"
The spinner of plates,blob,"December 16, 2022"
aestivator,Urgh. Yellow doesn't do it any favours but that rear 3/4 view in particular is awful.,"December 16, 2022"
ghost83,Not that pretty and wouldn’t spend that level of money on it as it will depreciate far quicker than a Macan,"December 16, 2022"
Wab1974uk,"There pricing is bonkers.I have a Macan S on order with some tasty options. All in, just over £70k. But that gets me 380bhp.Surely Maserati could have bridge the gap between 330bhp & 530bhp?At 380-400 bhp and priced against the Porsche I might have taken a look.","December 16, 2022"
carlo996,"Wab1974uk said: There pricing is bonkers.I have a Macan S on order with some tasty options. All in, just over £70k. But that gets me 380bhp.Surely Maserati could have bridge the gap between 330bhp & 530bhp?At 380-400 bhp and priced against the Porsche I might have taken a look.But Porsche likely have a car better dealer experience.","December 16, 2022"
Yarlsberg,Looks like a Suzuki Swift.Long gone are the days of captivating sweeping Pininfarina styling…,"December 16, 2022"
stuckmojo,"It's a Stelvio, isn't it?","December 16, 2022"
GTRene,It looks very BIG looking at this picture compared to the person driving it.,"December 16, 2022"
Wab1974uk,"carlo996 said: There pricing is bonkers.I have a Macan S on order with some tasty options. All in, just over £70k. But that gets me 380bhp.Surely Maserati could have bridge the gap between 330bhp & 530bhp?At 380-400 bhp and priced against the Porsche I might have taken a look.But Porsche likely have a car better dealer experience. From first hand experience, I'd say maybe not.","December 16, 2022"
Turbobanana,"Article said: The Grecale is aiming to be just like a Porsche MacanWell, it's failed then. Because this looks good.","December 16, 2022"
NMNeil,"""The Grecale is equipped with a comprehensive range of Level 2 Advanced Driving Assistance Systems, the highest level of driving automation support available on the market.""https://www.maserati.com/us/en/models/grecaleSo speed limiter fitted as standard, $102,000 sticker price, and it looks like so many other SUV's on the market.Can't see them flying off the showroom floor especially with the Maserati piss poor track record here in the US.https://www.hotcars.com/maserati-biturbo-looks-inc...","December 16, 2022"
Silvanus,"NGK210 said: Preferable to the usual suspects but similar to its Tonale cousin, it has ‘orrible front and rear overhangs. Is Stellantis trying to set a trend or prioritising platform-sharing economies of scale above aesthetics?Hss nothing in common with the Tonale, this is based on a heavily updated version of the Alfa Romeo Stelvio’s Giorgio platform. The Tonale is related to the the Jeep Compass and Dodge Hornet","December 16, 2022"
Kipsrs,In my humble opinion it’s a good looking car and a reasonable alternative to a Porsche. Not everyone is a Porsche fan and on that basis I can see this selling well. For me though I would take the Macan.,"December 16, 2022"
The spinner of plates,S600BSB said: Who'd want a fast estate car when you could be driving an SUV Maserati.,"December 16, 2022"
Mackofthejungle,"Christ, what the fk is that? Who's designing these things? Just look at it, bloody hell... It's horrific, utterly horrific. It looks 80s in all the wrong ways. Fat and crass. There's one reason only to buy a car like this, and it's badge. It looks worse than everything else, it'll have worse functionality than everything else (I thought the ""bad Italian electronics"" were a thing of the past, but recent experiences have taught me otherwise), and it'll drive like everything else (at best).","December 16, 2022"
don logan,"Turbobanana said:Article said: The Grecale is aiming to be just like a Porsche MacanWell, it's failed then. Because this looks good.It’s like a Macan but with hips and a real perrty mouth!!It’s the Macan Sophia Loren","December 16, 2022"
limpsfield,"don logan said:Turbobanana said:Article said: The Grecale is aiming to be just like a Porsche MacanWell, it's failed then. Because this looks good.It’s like a Macan but with hips and a real perrty mouth!!It’s the Macan Sophia LorenGreat line!","December 16, 2022"
Magikarp,That gops.,"December 16, 2022"
Roma101,"It may work better in a darker colour, but that looks a bit of a mess to me. It looks like a mash up of about 3 or 4 other cars. Pricing is punchy as well. Subject to what’s on the standard equipment list and how it drives, Maserati is asking a lot of people to convince them pay about £8k more for the 330hp version than a Macan S.Although it is tempting to use the default cliche of “sure it will sell well regardless”, I am not so sure with this one.","December 16, 2022"
Nickbrapp,Surely it’s more of a E pace rival than a F pace?,"December 16, 2022"
S600BSB,Who'd want a fast estate car when you could be driving an SUV Maserati.,"December 16, 2022"
Arsecati,"Ryan_T said: The headlights make it look like the Ford Puma crossover, ha. I think it's entire shape makes it look like a Ford Puma! It was the exact car that came to mind when I looked at the pictures, and you posting this confirmed it (so glad I wasn't the only one!).","December 16, 2022"
SYC378L,Another SUV tt chariot. &#128529;,"December 16, 2022"
ate one too,"In the flesh it looks only very slightly smaller than a Levante, having seen them side by side at Graypaul. It is bigger all round, inside and out compared to a Macan.","December 16, 2022"
Baldchap,"S600BSB said: Who'd want a fast estate car when you could be driving an SUV Maserati.Ooh, I know this one.  Me please.","December 16, 2022"
Roger Irrelevant,nismo48 said:GTRene said: It looks very BIG looking at this picture compared to the person driving it.+1 he does look rather lost This prompted me to check - it's a tiny bit longer than my 2014 XC70 and I doubt it's any narrower. When my Volvo was made eight short years ago it was considered to be a pretty large estate (still is I suppose). But this is apparently a 'compact' SUV. That seems a bit mad tbh.,"December 16, 2022"
NGK210,"Silvanus said: Hss nothing in common with the Tonale, this is based on a heavily updated version of the Alfa Romeo Stelvio’s Giorgio platform…Stelvio? Is that the much better looking, cheaper SUV with a Ferrari-designed V6 from a manufacturer that recently topped the JD Power Sales Satisfaction Index? https://www.motor1.com/news/621771/alfa-romeo-tops...","December 17, 2022"
duncs,"Mackofthejungle said: Christ, what the fk is that? Who's designing these things? Just look at it, bloody hell... It's horrific, utterly horrific. It looks 80s in all the wrong ways. Fat and crass. Thank goodness for this post, I was beginning to think there must be something wrong with my eyes because to me this thing is absolutely fking hideous, a complete mess, I can't believe this abomination was ever signed off as even 'that will do'. fking hell.","December 17, 2022"
Harry Flashman,"Turbobanana said: Well, I think we've ticked all the boxes:Italian electricsOverhangsPowerHow much?!?! Non-Germanic colourIt's not a MacanDepreciationPH: predictability matters. Oh, wait, 'Ring time. DamnI'm glad you like it - someone is going to have to buy that munter, and it won't be me.","December 17, 2022"
CrgT16,I would have Trofeo in yellow please.,"December 17, 2022"
Mr Tidy,"duncs said:Mackofthejungle said: Christ, what the fk is that? Who's designing these things? Just look at it, bloody hell... It's horrific, utterly horrific. It looks 80s in all the wrong ways. Fat and crass. Thank goodness for this post, I was beginning to think there must be something wrong with my eyes because to me this thing is absolutely fking hideous, a complete mess, I can't believe this abomination was ever signed off as even 'that will do'. fking hell.You aren't alone - it's a minger!Why does the waistline have to be above your shoulder?","December 17, 2022"
Silvanus,"NGK210 said: Hss nothing in common with the Tonale, this is based on a heavily updated version of the Alfa Romeo Stelvio’s Giorgio platform…Stelvio? Is that the much better looking, cheaper SUV with a Ferrari-designed V6 from a manufacturer that recently topped the JD Power Sales Satisfaction Index? https://www.motor1.com/news/621771/alfa-romeo-tops... yep, you'd be mad to chose the top spec one of these over a Quadrifoglio","December 17, 2022"
